{
  "schema": "regelsuche.historical-rediscovery-corpus/v1",
  "evidenceStatus": "FROZEN_DIAGNOSTIC_CORPUS",
  "inventoryRevision": "production-ast-rules-plus-generic-hypothesis-controls/v1",
  "claimBoundary": "Target-aware reachability and published-identity rediscovery diagnostics only. A positive result is not external novelty, and a bounded miss is not global unreachability unless the declared finite closure is exhausted.",
  "cases": [
    {
      "id": "complete-square",
      "family": "COMPLETING_THE_SQUARE",
      "source": "x*x + 2*x*y + y*y",
      "target": "(x+y)^2",
      "relation": "EQUIVALENT",
      "role": "HISTORICAL_POSITIVE",
      "diagnosticPurpose": "PRODUCTION_INVENTORY_REACHABILITY",
      "provenance": "STANDARD_CLASSICAL_ALGEBRA_IDENTITY",
      "targetRelation": "SYNTAX_EXACT",
      "oracleMaxDepth": 4,
      "oracleMaxVisitedStates": 300,
      "searchMaxDepth": 4,
      "searchMaxVisitedStates": 80,
      "maxCandidatesPerState": 48,
      "maxExpandingSteps": 4,
      "beamWidth": 12
    },
    {
      "id": "reordered-square",
      "family": "COMPLETING_THE_SQUARE",
      "source": "x*x + y*y + 2*y*x",
      "target": "(x+y)^2",
      "relation": "EQUIVALENT",
      "role": "HISTORICAL_POSITIVE",
      "diagnosticPurpose": "AC_RECOGNITION_AND_PRODUCTION_REACHABILITY",
      "provenance": "STANDARD_CLASSICAL_ALGEBRA_IDENTITY",
      "targetRelation": "SYNTAX_EXACT",
      "oracleMaxDepth": 4,
      "oracleMaxVisitedStates": 300,
      "searchMaxDepth": 4,
      "searchMaxVisitedStates": 80,
      "maxCandidatesPerState": 48,
      "maxExpandingSteps": 4,
      "beamWidth": 12
    },
    {
      "id": "regrouped-square",
      "family": "COMPLETING_THE_SQUARE",
      "source": "y*y + (2*x)*y + x*x",
      "target": "(x+y)^2",
      "relation": "EQUIVALENT",
      "role": "HISTORICAL_POSITIVE",
      "diagnosticPurpose": "AC_RECOGNITION_AND_PRODUCTION_REACHABILITY",
      "provenance": "STANDARD_CLASSICAL_ALGEBRA_IDENTITY",
      "targetRelation": "SYNTAX_EXACT",
      "oracleMaxDepth": 4,
      "oracleMaxVisitedStates": 300,
      "searchMaxDepth": 4,
      "searchMaxVisitedStates": 80,
      "maxCandidatesPerState": 48,
      "maxExpandingSteps": 4,
      "beamWidth": 12
    },
    {
      "id": "scaled-square",
      "family": "COMPLETING_THE_SQUARE",
      "source": "x*x + 3*x*a + 2.25*a*a",
      "target": "(x+1.5*a)^2",
      "relation": "EQUIVALENT",
      "role": "HISTORICAL_POSITIVE",
      "diagnosticPurpose": "NUMERIC_COEFFICIENT_RECOGNITION",
      "provenance": "STANDARD_CLASSICAL_ALGEBRA_IDENTITY",
      "targetRelation": "SYNTAX_EXACT",
      "oracleMaxDepth": 4,
      "oracleMaxVisitedStates": 300,
      "searchMaxDepth": 4,
      "searchMaxVisitedStates": 80,
      "maxCandidatesPerState": 48,
      "maxExpandingSteps": 4,
      "beamWidth": 12
    },
    {
      "id": "fractional-square",
      "family": "COMPLETING_THE_SQUARE",
      "source": "x*x + (4/3)*x*y + (4/9)*y*y",
      "target": "(x+(2/3)*y)^2",
      "relation": "EQUIVALENT",
      "role": "HISTORICAL_POSITIVE",
      "diagnosticPurpose": "RATIONAL_COEFFICIENT_RECOGNITION",
      "provenance": "STANDARD_CLASSICAL_ALGEBRA_IDENTITY",
      "targetRelation": "SYNTAX_EXACT",
      "oracleMaxDepth": 4,
      "oracleMaxVisitedStates": 400,
      "searchMaxDepth": 4,
      "searchMaxVisitedStates": 100,
      "maxCandidatesPerState": 60,
      "maxExpandingSteps": 4,
      "beamWidth": 12
    },
    {
      "id": "difference-of-squares",
      "family": "FACTORIZATION",
      "source": "a*a - b*b",
      "target": "(a-b)*(a+b)",
      "relation": "EQUIVALENT",
      "role": "HISTORICAL_POSITIVE",
      "diagnosticPurpose": "PRODUCTION_PRIMITIVE_POSITIVE_CONTROL",
      "provenance": "STANDARD_DIFFERENCE_OF_SQUARES_IDENTITY",
      "targetRelation": "SYNTAX_EXACT",
      "oracleMaxDepth": 3,
      "oracleMaxVisitedStates": 160,
      "searchMaxDepth": 3,
      "searchMaxVisitedStates": 60,
      "maxCandidatesPerState": 48,
      "maxExpandingSteps": 3,
      "beamWidth": 10
    },
    {
      "id": "difference-of-squares-powers",
      "family": "FACTORIZATION",
      "source": "m^2 - n^2",
      "target": "(m-n)*(m+n)",
      "relation": "EQUIVALENT",
      "role": "HISTORICAL_POSITIVE",
      "diagnosticPurpose": "PRODUCTION_PRIMITIVE_POSITIVE_CONTROL",
      "provenance": "STANDARD_DIFFERENCE_OF_SQUARES_IDENTITY",
      "targetRelation": "SYNTAX_EXACT",
      "oracleMaxDepth": 2,
      "oracleMaxVisitedStates": 80,
      "searchMaxDepth": 2,
      "searchMaxVisitedStates": 40,
      "maxCandidatesPerState": 48,
      "maxExpandingSteps": 2,
      "beamWidth": 8
    },
    {
      "id": "factor-common-left",
      "family": "FACTORIZATION",
      "source": "a*x + a*y",
      "target": "a*(x+y)",
      "relation": "EQUIVALENT",
      "role": "HISTORICAL_POSITIVE",
      "diagnosticPurpose": "PRODUCTION_PRIMITIVE_POSITIVE_CONTROL",
      "provenance": "DISTRIBUTIVE_LAW_REVERSED",
      "targetRelation": "SYNTAX_EXACT",
      "oracleMaxDepth": 2,
      "oracleMaxVisitedStates": 80,
      "searchMaxDepth": 2,
      "searchMaxVisitedStates": 40,
      "maxCandidatesPerState": 48,
      "maxExpandingSteps": 2,
      "beamWidth": 8
    },
    {
      "id": "factor-common-right",
      "family": "FACTORIZATION",
      "source": "x*a + y*a",
      "target": "(x+y)*a",
      "relation": "EQUIVALENT",
      "role": "HISTORICAL_POSITIVE",
      "diagnosticPurpose": "PRODUCTION_PRIMITIVE_POSITIVE_CONTROL",
      "provenance": "DISTRIBUTIVE_LAW_REVERSED",
      "targetRelation": "SYNTAX_EXACT",
      "oracleMaxDepth": 2,
      "oracleMaxVisitedStates": 80,
      "searchMaxDepth": 2,
      "searchMaxVisitedStates": 40,
      "maxCandidatesPerState": 48,
      "maxExpandingSteps": 2,
      "beamWidth": 8
    },
    {
      "id": "expand-binomial-square",
      "family": "TEMPORARY_COMPLEXITY",
      "source": "(x+y)^2",
      "target": "x*x + 2*x*y + y*y",
      "relation": "EQUIVALENT",
      "role": "HISTORICAL_POSITIVE",
      "diagnosticPurpose": "DIRECTIONALITY_AND_SCALAR_FITNESS_VALLEY",
      "provenance": "BINOMIAL_SQUARE_EXPANSION",
      "targetRelation": "SYNTAX_EXACT",
      "oracleMaxDepth": 6,
      "oracleMaxVisitedStates": 600,
      "searchMaxDepth": 6,
      "searchMaxVisitedStates": 120,
      "maxCandidatesPerState": 64,
      "maxExpandingSteps": 6,
      "beamWidth": 16
    },
    {
      "id": "reverse-difference-of-squares",
      "family": "TEMPORARY_COMPLEXITY",
      "source": "(a-b)*(a+b)",
      "target": "a*a - b*b",
      "relation": "EQUIVALENT",
      "role": "HISTORICAL_POSITIVE",
      "diagnosticPurpose": "REVERSE_DIRECTION_THROUGH_EXPANSION",
      "provenance": "DIFFERENCE_OF_SQUARES_EXPANSION",
      "targetRelation": "SYNTAX_EXACT",
      "oracleMaxDepth": 6,
      "oracleMaxVisitedStates": 600,
      "searchMaxDepth": 6,
      "searchMaxVisitedStates": 120,
      "maxCandidatesPerState": 64,
      "maxExpandingSteps": 6,
      "beamWidth": 16
    },
    {
      "id": "sophie-germain",
      "family": "HIDDEN_STRUCTURE_BRIDGE",
      "source": "x^4 + 4*y^4",
      "target": "(x^2 + 2*y^2 - 2*x*y) * (x^2 + 2*y^2 + 2*x*y)",
      "relation": "EQUIVALENT",
      "role": "HISTORICAL_POSITIVE",
      "diagnosticPurpose": "GENERIC_HYPOTHESIS_BRIDGE",
      "provenance": "STANDARD_NAMED_SOPHIE_GERMAIN_IDENTITY",
      "targetRelation": "VALUE_EQUIVALENT",
      "oracleMaxDepth": 5,
      "oracleMaxVisitedStates": 800,
      "searchMaxDepth": 5,
      "searchMaxVisitedStates": 160,
      "maxCandidatesPerState": 80,
      "maxExpandingSteps": 8,
      "beamWidth": 20
    },
    {
      "id": "distribution-fitness-valley-control",
      "family": "SEARCH_POLICY_CONTROL",
      "source": "(x+0)*(a+b)",
      "target": "(x+0)*a + (x+0)*b",
      "relation": "EQUIVALENT",
      "role": "SEARCH_POLICY_CONTROL",
      "diagnosticPurpose": "SCALAR_PRIORITY_VERSUS_STRUCTURAL_DIVERSITY",
      "provenance": "SYNTHETIC_INFORMATION_PARITY_CONTROL",
      "targetRelation": "SYNTAX_EXACT",
      "oracleMaxDepth": 2,
      "oracleMaxVisitedStates": 120,
      "searchMaxDepth": 2,
      "searchMaxVisitedStates": 3,
      "maxCandidatesPerState": 48,
      "maxExpandingSteps": 2,
      "beamWidth": 2
    },
    {
      "id": "inconsistent-near-miss",
      "family": "NEGATIVE_CONTROL",
      "source": "x*x + 3*x*a + a*a",
      "target": "(x+1.5*a)^2",
      "relation": "NOT_EQUIVALENT",
      "role": "NEGATIVE_CONTROL",
      "diagnosticPurpose": "FALSE_NEARBY_IDENTITY_MUST_REMAIN_REJECTED",
      "provenance": "NEGATIVE_CONTROL_DERIVED_FROM_COMPLETING_THE_SQUARE",
      "targetRelation": "SYNTAX_EXACT",
      "oracleMaxDepth": 4,
      "oracleMaxVisitedStates": 300,
      "searchMaxDepth": 4,
      "searchMaxVisitedStates": 80,
      "maxCandidatesPerState": 48,
      "maxExpandingSteps": 4,
      "beamWidth": 12
    }
  ]
}
